id,podcast_name,episode_code,title,phase_id,subperiod_id,main_topic_id,duration,published,priority,apple_url,summary
ep_historia_en_podcast_65_neolitico,Historia en Podcast,65,65. La Prehistoria: El Neolítico,phase_01,sub_0110,topic_neolitico,,,3,https://podcasts.apple.com/es/podcast/65-la-prehistoria-el-neol%C3%ADtico/id1503363327?i=1000519608384,"Episodio centrado en la Revolución Neolítica, sedentarismo, agricultura, domesticación, primeras ciudades y origen de la escritura."
ep_historia_con_movil_neolitico,Historia con el móvil,,El Neolítico ¿Evolución o Involución?,phase_01,sub_0110,topic_neolitico,29 min,2020-09-02,2,https://podcasts.apple.com/es/podcast/el-neol%C3%ADtico-evoluci%C3%B3n-o-involuci%C3%B3n/id1219460034?i=1000574622907,"Episodio breve sobre el Neolítico, útil como entrada introductoria."
ep_la_historia_espana_prehistoria_peninsula,La Historia de España,3,Prehistoria de la península ibérica | Episodio 3,phase_01,sub_0108,topic_prehistoria_peninsula_iberica,,2020-12-13,3,https://podcasts.apple.com/es/podcast/prehistoria-de-la-pen%C3%ADnsula-ib%C3%A9rica-episodio-3/id1544923756?i=1000502432135,Recorrido por la prehistoria de la península ibérica desde el Paleolítico hasta la Edad del Bronce.
ep_planeta_muy_neandertales,Planeta Muy,3,Capítulo 3: Caminando entre neandertales - Con Javier Baena,phase_01,sub_0106,topic_neandertales,,,2,https://podcasts.apple.com/es/podcast/cap%C3%ADtulo-3-caminando-entre-neandertales-con-javier-baena/id1588051336?i=1000536973313,"Episodio divulgativo sobre vida, costumbres y capacidades de los neandertales."
ep_ser_historia_origen_prehistoria,SER Historia,,Origen: la prehistoria en la evolución humana,phase_01,sub_0107,topic_evolucion_humana,,,2,https://podcasts.apple.com/es/podcast/origen-la-prehistoria-en-la-evoluci%C3%B3n-humana/id744062884?i=1000629179532,Entrevista sobre prehistoria y evolución humana con Carlos Díez.
ep_un_podcast_salud_alimentacion_evolucion,Un podcast de salud,,ALIMENTACIÓN. ¿Cómo nos afecta lo que comemos?,phase_01,sub_0107,topic_alimentacion_evolucion,,2022-11-30,1,https://podcasts.apple.com/es/podcast/alimentaci%C3%B3n-c%C3%B3mo-nos-afecta-lo-que-comemos/id1533265652?i=1000588115974,Episodio sanitario-divulgativo con componente útil sobre alimentación y evolución humana.
ep_clima_historia_neandertales_sahara,Podcast histórico pendiente de normalizar,,"El clima en la historia: crisis, imperios y supervivencia",phase_01,sub_0106,topic_clima_prehistoria,,2026,1,https://podcasts.apple.com/es/podcast/el-clima-en-la-historia-crisis-imperios-y/id1150909157?i=1000765992453,"Episodio sobre clima, eventos Heinrich, neandertales, Sáhara verde y nacimiento de Egipto faraónico."
